{
  "schema": "lattice.todo_witness_set.v5",
  "project_id": "lattice",
  "plan_key": "runtime-close-stale-base-20260809",
  "capacity": {
    "executors": 1
  },
  "sensor_query_set": {
    "queries": [
      {
        "id": "q-run-close",
        "operation": "query",
        "target": "runClose"
      },
      {
        "id": "q-runtime-landing-test",
        "operation": "affected",
        "target": "test/runtime-landing-cli.test.mjs"
      },
      {
        "id": "q-status",
        "operation": "status"
      }
    ]
  },
  "manual_witness": {
    "c1": {
      "owns": [
        {
          "kind": "symbol",
          "target": "runClose"
        },
        {
          "kind": "path",
          "target": "test/runtime-landing-cli.test.mjs"
        },
        {
          "kind": "path",
          "target": "evidence/runtime-close-stale-base-20260809/c1.md",
          "creates": true
        }
      ],
      "reads": [],
      "writes": [
        "evidence/runtime-close-stale-base-20260809/c1.md",
        "src/runtime-cli.mjs",
        "test/runtime-landing-cli.test.mjs"
      ],
      "resources": [],
      "state_effects": [],
      "sensor_provenance": {
        "queries": [
          {
            "query_id": "q-run-close",
            "expect": {
              "kind": "symbol",
              "name": "runClose",
              "path": "src/runtime-cli.mjs"
            }
          },
          {
            "query_id": "q-runtime-landing-test",
            "expect": {
              "kind": "affected",
              "path": "test/runtime-landing-cli.test.mjs"
            }
          }
        ]
      },
      "affected_tests": [
        "test/runtime-landing-cli.test.mjs"
      ],
      "unknowns": []
    }
  },
  "witness_set_digest": "011052d43d36b12eb1e4a096875f683312bb1389c11f80d085bc117b414ce74f"
}
