{"capacity":{"executors":1},"manual_witness":{"ac1":{"affected_tests":["test/cli-help.test.mjs","test/todo-cli.test.mjs","test/todo-store-atomic-commit.test.mjs"],"owns":[{"kind":"path","target":"src/cli-help.mjs"},{"kind":"path","target":"src/todo-cli.mjs"},{"creates":true,"kind":"path","target":"src/todo-store-git-transaction.mjs"},{"creates":true,"kind":"path","target":"test/todo-store-atomic-commit.test.mjs"}],"reads":["src/runtime-lifecycle-lock.mjs","src/todo-note-store.mjs","src/todo-store.mjs"],"resources":["git-common-store-commit-lock"],"sensor_provenance":{"queries":[{"expect":{"kind":"affected","path":"src/cli-help.mjs"},"query_id":"q-ac1-cli-help"},{"expect":{"kind":"affected","path":"src/todo-cli.mjs"},"query_id":"q-ac1-todo-cli"}]},"state_effects":[{"kind":"state","resource_id":"git-common-store-commit-lock"}],"unknowns":[],"writes":["src/cli-help.mjs","src/todo-cli.mjs","src/todo-store-git-transaction.mjs","test/todo-store-atomic-commit.test.mjs"]},"ac2":{"affected_tests":["test/integration/todo-store-atomic-commit.integration.mjs"],"owns":[{"kind":"path","target":".team/scripts/done.sh"},{"creates":true,"kind":"path","target":"test/integration/todo-store-atomic-commit.integration.mjs"},{"creates":true,"kind":"path","target":"evidence/todo-store-atomic-commit-20260809/ac2.md"}],"reads":["src/todo-store-git-transaction.mjs"],"resources":["git-common-store-commit-lock"],"sensor_provenance":{"queries":[{"expect":{"kind":"affected","path":".team/scripts/done.sh"},"query_id":"q-ac2-done-script"}]},"state_effects":[{"kind":"state","resource_id":"git-common-store-commit-lock"}],"unknowns":[],"writes":[".team/scripts/done.sh","test/integration/todo-store-atomic-commit.integration.mjs","evidence/todo-store-atomic-commit-20260809/ac2.md"]},"ac3":{"affected_tests":[],"owns":[{"kind":"path","target":"package.json"},{"kind":"path","target":"package-lock.json"},{"creates":true,"kind":"path","target":"evidence/todo-store-atomic-commit-20260809/ac3.md"}],"reads":["src/todo-store-git-transaction.mjs"],"resources":["npm-registry","global-lattice-install"],"sensor_provenance":{"queries":[{"expect":{"kind":"affected","path":"package.json"},"query_id":"q-ac3-package"}]},"state_effects":[{"kind":"external_effect","resource_id":"npm-registry"},{"kind":"external_effect","resource_id":"global-lattice-install"}],"unknowns":[],"writes":["package.json","package-lock.json","evidence/todo-store-atomic-commit-20260809/ac3.md"]}},"plan_key":"todo-store-atomic-commit-20260809","project_id":"lattice","schema":"lattice.todo_witness_set.v5","sensor_query_set":{"queries":[{"id":"q-ac1-cli-help","operation":"affected","target":"src/cli-help.mjs"},{"id":"q-ac1-todo-cli","operation":"affected","target":"src/todo-cli.mjs"},{"id":"q-ac2-done-script","operation":"affected","target":".team/scripts/done.sh"},{"id":"q-ac3-package","operation":"affected","target":"package.json"},{"id":"witness-status","operation":"status"}]},"witness_set_digest":"a72e026741f3b03f5dd4ef0d4e1cef1401e192c50cd8b791858b472c8e0b9f29"}
