{"capacity":{"executors":2},"manual_witness":{"k1":{"affected_tests":["test/integration/aishell-runtime-conflict-dogfood.integration.mjs","test/project-cli.test.mjs","test/project-status-audit-pending.test.mjs","test/runtime-adapter-registry-cli.test.mjs","test/runtime-canonical-write-coverage.test.mjs","test/runtime-conflict-cli.test.mjs","test/runtime-lifecycle-lock.test.mjs","test/runtime-managed-supervisor.test.mjs","test/runtime-pull-intake-cli.test.mjs","test/runtime-scripted-adapter-controller.test.mjs","test/runtime-work-order-controller.test.mjs","test/session-context.test.mjs","test/todo-audit-pending-e2e.test.mjs","test/todo-note-gantt.test.mjs","test/todo-obligations-e2e.test.mjs","test/todo-status-plan-notes.test.mjs"],"concern_anchors":[{"symbols":["driveScriptedManagedEpoch","runActivate","runManagedSupervisorDaemon","runObserve","runStatus"],"within":{"kind":"path","target":"src/runtime-cli.mjs"}}],"owns":[{"kind":"path","target":"src/cli-help.mjs"},{"kind":"path","target":"src/runtime-cli.mjs"},{"creates":true,"kind":"path","target":"src/runtime-driver-state.mjs"},{"creates":true,"kind":"path","target":"test/integration/runtime-driver-state.integration.mjs"},{"creates":true,"kind":"path","target":"test/runtime-driver-state.test.mjs"}],"reads":["src/runtime-managed-supervisor.mjs","src/runtime-projection.mjs"],"resources":[],"sensor_provenance":{"queries":[{"expect":{"kind":"affected","path":"src/cli-help.mjs"},"query_id":"witness-affected-000"},{"expect":{"kind":"affected","path":"src/runtime-cli.mjs"},"query_id":"witness-affected-001"},{"expect":{"kind":"affected","path":"src/runtime-driver-state.mjs"},"query_id":"witness-affected-002"},{"expect":{"kind":"affected","path":"test/integration/runtime-driver-state.integration.mjs"},"query_id":"witness-affected-004"},{"expect":{"kind":"affected","path":"test/runtime-driver-state.test.mjs"},"query_id":"witness-affected-005"}]},"state_effects":[],"unknowns":[],"writes":["src/cli-help.mjs","src/runtime-cli.mjs","src/runtime-driver-state.mjs","test/integration/runtime-driver-state.integration.mjs","test/runtime-driver-state.test.mjs"]},"k2":{"affected_tests":["test/integration/aishell-runtime-conflict-dogfood.integration.mjs","test/integration/runtime-seam-resolve-cli.integration.mjs","test/project-cli.test.mjs","test/project-status-audit-pending.test.mjs","test/runtime-adapter-registry-cli.test.mjs","test/runtime-canonical-write-coverage.test.mjs","test/runtime-conflict-cli.test.mjs","test/runtime-io-sentinel.test.mjs","test/runtime-lifecycle-lock.test.mjs","test/runtime-line-observation.test.mjs","test/runtime-managed-supervisor.test.mjs","test/runtime-multi-epoch-store.test.mjs","test/runtime-pull-intake-cli.test.mjs","test/runtime-scripted-adapter-controller.test.mjs","test/runtime-work-order-controller.test.mjs","test/session-context.test.mjs","test/todo-audit-pending-e2e.test.mjs","test/todo-note-gantt.test.mjs","test/todo-obligations-e2e.test.mjs","test/todo-status-plan-notes.test.mjs"],"concern_anchors":[{"symbols":["readRunStore","runRuntimeCli"],"within":{"kind":"path","target":"src/runtime-cli.mjs"}},{"symbols":["normalizeActivationMeta","readCommittedEpochStore","validateRunMetaV2"],"within":{"kind":"path","target":"src/runtime-multi-epoch-store.mjs"}}],"owns":[{"kind":"path","target":"src/runtime-cli.mjs"},{"kind":"path","target":"src/runtime-multi-epoch-store.mjs"},{"creates":true,"kind":"path","target":"test/runtime-schema-version-diagnostics.test.mjs"}],"reads":["src/runtime-work-order-contracts.mjs"],"resources":[],"sensor_provenance":{"queries":[{"expect":{"kind":"affected","path":"src/runtime-cli.mjs"},"query_id":"witness-affected-001"},{"expect":{"kind":"affected","path":"src/runtime-multi-epoch-store.mjs"},"query_id":"witness-affected-003"},{"expect":{"kind":"affected","path":"test/runtime-schema-version-diagnostics.test.mjs"},"query_id":"witness-affected-006"}]},"state_effects":[],"unknowns":[],"writes":["src/runtime-cli.mjs","src/runtime-multi-epoch-store.mjs","test/runtime-schema-version-diagnostics.test.mjs"]}},"plan_key":"roundtable-carryover-20260809","project_id":"lattice","schema":"lattice.todo_witness_set.v5","sensor_query_set":{"queries":[{"id":"witness-affected-000","operation":"affected","target":"src/cli-help.mjs"},{"id":"witness-affected-001","operation":"affected","target":"src/runtime-cli.mjs"},{"id":"witness-affected-002","operation":"affected","target":"src/runtime-driver-state.mjs"},{"id":"witness-affected-003","operation":"affected","target":"src/runtime-multi-epoch-store.mjs"},{"id":"witness-affected-004","operation":"affected","target":"test/integration/runtime-driver-state.integration.mjs"},{"id":"witness-affected-005","operation":"affected","target":"test/runtime-driver-state.test.mjs"},{"id":"witness-affected-006","operation":"affected","target":"test/runtime-schema-version-diagnostics.test.mjs"},{"id":"witness-status","operation":"status"}]},"witness_set_digest":"e684a4febb90249f83a1a153ab3ba1edba7567001befc97695b872c04d268027"}
